{"datasets":[{"byteLength":760,"capability":"supported","name":"accounts","observationWindow":{"endedAtUtc":"2026-01-15T08:00:10.000Z","startedAtUtc":"2026-01-15T08:00:00.000Z"},"path":"data/normalized/accounts.ndjson","reasonCodes":[],"recordCount":1,"recordType":"account","requestState":"requested","result":"complete_as_observed"},{"byteLength":852,"capability":"supported","name":"contacts","observationWindow":{"endedAtUtc":"2026-01-15T08:00:10.000Z","startedAtUtc":"2026-01-15T08:00:00.000Z"},"path":"data/normalized/contacts.ndjson","reasonCodes":[],"recordCount":1,"recordType":"contact","requestState":"requested","result":"complete_as_observed"},{"byteLength":946,"capability":"supported","name":"chats","observationWindow":{"endedAtUtc":"2026-01-15T08:00:10.000Z","startedAtUtc":"2026-01-15T08:00:00.000Z"},"path":"data/normalized/chats.ndjson","reasonCodes":[],"recordCount":1,"recordType":"chat","requestState":"requested","result":"complete_as_observed"},{"byteLength":496,"capability":"supported","name":"chat_lists","observationWindow":{"endedAtUtc":"2026-01-15T08:00:10.000Z","startedAtUtc":"2026-01-15T08:00:00.000Z"},"path":"data/normalized/chat-lists.ndjson","reasonCodes":[],"recordCount":1,"recordType":"chat_list","requestState":"requested","result":"complete_as_observed"},{"byteLength":1340,"capability":"supported","name":"participants","observationWindow":{"endedAtUtc":"2026-01-15T08:00:10.000Z","startedAtUtc":"2026-01-15T08:00:00.000Z"},"path":"data/normalized/participants.ndjson","reasonCodes":[],"recordCount":2,"recordType":"participant","requestState":"requested","result":"complete_as_observed"},{"byteLength":3869,"capability":"supported","name":"messages","observationWindow":{"endedAtUtc":"2026-01-15T08:00:10.000Z","startedAtUtc":"2026-01-15T08:00:00.000Z"},"path":"data/normalized/messages.ndjson","reasonCodes":[],"recordCount":3,"recordType":"message","requestState":"requested","result":"complete_as_observed"},{"byteLength":0,"capability":"supported","name":"message_events","observationWindow":{"endedAtUtc":"2026-01-15T08:00:10.000Z","startedAtUtc":"2026-01-15T08:00:00.000Z"},"path":"data/normalized/message-events.ndjson","reasonCodes":[],"recordCount":0,"recordType":"message_event","requestState":"requested","result":"empty"},{"byteLength":0,"capability":"supported","name":"reactions","observationWindow":{"endedAtUtc":"2026-01-15T08:00:10.000Z","startedAtUtc":"2026-01-15T08:00:00.000Z"},"path":"data/normalized/reactions.ndjson","reasonCodes":[],"recordCount":0,"recordType":"reaction","requestState":"requested","result":"empty"},{"byteLength":0,"capability":"supported","name":"receipts","observationWindow":{"endedAtUtc":"2026-01-15T08:00:10.000Z","startedAtUtc":"2026-01-15T08:00:00.000Z"},"path":"data/normalized/receipts.ndjson","reasonCodes":[],"recordCount":0,"recordType":"receipt","requestState":"requested","result":"empty"},{"byteLength":0,"capability":"supported","name":"poll_votes","observationWindow":{"endedAtUtc":"2026-01-15T08:00:10.000Z","startedAtUtc":"2026-01-15T08:00:00.000Z"},"path":"data/normalized/poll-votes.ndjson","reasonCodes":[],"recordCount":0,"recordType":"poll_vote","requestState":"requested","result":"empty"},{"byteLength":0,"capability":"supported","name":"group_events","observationWindow":{"endedAtUtc":"2026-01-15T08:00:10.000Z","startedAtUtc":"2026-01-15T08:00:00.000Z"},"path":"data/normalized/group-events.ndjson","reasonCodes":[],"recordCount":0,"recordType":"group_event","requestState":"requested","result":"empty"},{"byteLength":0,"capability":"supported","name":"statuses","observationWindow":null,"path":"data/normalized/statuses.ndjson","reasonCodes":["fixture_scope_not_requested"],"recordCount":0,"recordType":"status","requestState":"not_requested","result":"not_requested"},{"byteLength":0,"capability":"supported","name":"calls","observationWindow":null,"path":"data/normalized/calls.ndjson","reasonCodes":["fixture_scope_not_requested"],"recordCount":0,"recordType":"call","requestState":"not_requested","result":"not_requested"},{"byteLength":0,"capability":"supported","name":"channels","observationWindow":null,"path":"data/normalized/channels.ndjson","reasonCodes":["fixture_scope_not_requested"],"recordCount":0,"recordType":"channel","requestState":"not_requested","result":"not_requested"},{"byteLength":0,"capability":"supported","name":"channel_events","observationWindow":null,"path":"data/normalized/channel-events.ndjson","reasonCodes":["fixture_scope_not_requested"],"recordCount":0,"recordType":"channel_event","requestState":"not_requested","result":"not_requested"},{"byteLength":0,"capability":"supported","name":"communities","observationWindow":null,"path":"data/normalized/communities.ndjson","reasonCodes":["fixture_scope_not_requested"],"recordCount":0,"recordType":"community","requestState":"not_requested","result":"not_requested"},{"byteLength":0,"capability":"supported","name":"community_relations","observationWindow":null,"path":"data/normalized/community-relations.ndjson","reasonCodes":["fixture_scope_not_requested"],"recordCount":0,"recordType":"community_relation","requestState":"not_requested","result":"not_requested"},{"byteLength":0,"capability":"supported","name":"presence_snapshots","observationWindow":null,"path":"data/normalized/presence-snapshots.ndjson","reasonCodes":["fixture_scope_not_requested"],"recordCount":0,"recordType":"presence_snapshot","requestState":"not_requested","result":"not_requested"}],"generatedAtUtc":"2026-01-15T08:00:10.000Z","schemaVersion":"1.0.0","sourceId":"22222222-2222-4222-8222-222222222222"}
